[
  {
    "id": "bd1f42c050a6",
    "title": "01-4 第一套 第四讲 .mp4",
    "url": "https://pan.quark.cn/s/bd1f42c050a6",
    "accessCode": "",
    "provider": "quark",
    "category": "uncategorized",
    "tags": [],
    "description": "",
    "status": "active",
    "publishedAt": "2026-07-27"
  },
  {
    "id": "be9480cbb9d1",
    "title": "01-1 第一套 第一讲 .mp4",
    "url": "https://pan.quark.cn/s/be9480cbb9d1",
    "accessCode": "",
    "provider": "quark",
    "category": "uncategorized",
    "tags": [],
    "description": "",
    "status": "active",
    "publishedAt": "2026-07-27"
  },
  {
    "id": "7a3be376ffe2",
    "title": "间谍过家家 第一季 1080P",
    "url": "https://pan.quark.cn/s/7a3be376ffe2",
    "accessCode": "",
    "provider": "quark",
    "category": "uncategorized",
    "tags": [],
    "description": "",
    "status": "active",
    "publishedAt": "2026-07-27"
  },
  {
    "id": "aa4efc4de2d6",
    "title": "剧场版",
    "url": "https://pan.quark.cn/s/aa4efc4de2d6",
    "accessCode": "",
    "provider": "quark",
    "category": "uncategorized",
    "tags": [],
    "description": "",
    "status": "active",
    "publishedAt": "2026-07-27"
  },
  {
    "id": "aa588c4de2d6",
    "title": "ceshi",
    "url": "https://pan.quark.cn/s/aa588c4de2d6",
    "accessCode": "",
    "provider": "quark",
    "category": "uncategorized",
    "tags": [],
    "description": "",
    "status": "active",
    "publishedAt": "2026-07-28"
  },
  {
    "id": "ee01914abb2e",
    "title": "mobaXterm_professional",
    "url": "https://pan.quark.cn/s/ee01914abb2e",
    "accessCode": "",
    "provider": "quark",
    "category": "软件",
    "tags": [],
    "description": "",
    "status": "active",
    "publishedAt": "2026-07-28"
  },
  {
    "id": "cccc914abb2e",
    "title": "ces2",
    "url": "https://pan.quark.cn/s/cccc914abb2e",
    "accessCode": "",
    "provider": "quark",
    "category": "uncategorized",
    "tags": [],
    "description": "",
    "status": "active",
    "publishedAt": "2026-07-30"
  },
  {
    "id": "3333914abb2e",
    "title": "ces3",
    "url": "https://pan.quark.cn/s/3333914abb2e",
    "accessCode": "",
    "provider": "quark",
    "category": "uncategorized",
    "tags": [],
    "description": "",
    "status": "active",
    "publishedAt": "2026-07-30"
  },
  {
    "id": "35eabe3b007f",
    "title": "7月30日付费文",
    "url": "https://pan.quark.cn/s/35eabe3b007f",
    "accessCode": "",
    "provider": "quark",
    "category": "uncategorized",
    "tags": [],
    "description": "",
    "status": "active",
    "publishedAt": "2026-07-31"
  }
]
